{
  "runtime": { "name": "generic-agents", "version": "unknown" },
  "protocol_versions": { "minimum": "1.0.0", "maximum": "1.x" },
  "capabilities": {
    "native_subagents": false,
    "isolated_subagents": false,
    "parallel_execution": false,
    "structured_output": false,
    "file_editing": false,
    "command_execution": false,
    "approval_prompts": false,
    "git_operations": false,
    "network_access": false,
    "persistent_sessions": false,
    "cancellation": false
  },
  "limits": { "maximum_parallel_workers": null, "maximum_context_tokens": null },
  "evidence": { "tested_at": "2026-07-20", "test_type": "structural", "notes": [] }
}
